{
  "schema_version": "v25r2",
  "created_at": "2025-08-11T21:22:26.461820Z",
  "counts": {
    "total": 383,
    "math": 240,
    "text": 119,
    "any": 24
  },
  "macros": [
    {
      "name": "AA",
      "mode": "text",
      "category": "text-symbol",
      "arity": 0,
      "safety": "pure",
      "side_effects": [],
      "expansion": [
        {
          "TText": "√Ö"
        }
      ],
      "body": [
        {
          "TText": "√Ö"
        }
      ],
      "expand_in_math": false,
      "expand_in_text": true,
      "non_expandable": true,
      "notes": "",
      "source": "derived-from:v1-catalogue",
      "_legacy_single_token": true
    },
    {
      "name": "AE",
      "mode": "text",
      "category": "text-symbol",
      "arity": 0,
      "safety": "pure",
      "side_effects": [],
      "expansion": [
        {
          "TText": "√Ü"
        }
      ],
      "body": [
        {
          "TText": "√Ü"
        }
      ],
      "expand_in_math": false,
      "expand_in_text": true,
      "non_expandable": true,
      "notes": "",
      "source": "derived-from:v1-catalogue",
      "_legacy_single_token": true
    },
    {
      "name": "Bbbk",
      "mode": "text",
      "category": "text-symbol",
      "arity": 0,
      "safety": "pure",
      "side_effects": [],
      "expansion": [
        {
          "TText": "ùïú"
        }
      ],
      "body": [
        {
          "TText": "ùïú"
        }
      ],
      "expand_in_math": false,
      "expand_in_text": true,
      "non_expandable": true,
      "notes": "",
      "source": "derived-from:v1-catalogue",
      "_legacy_single_token": true
    },
    {
      "name": "Box",
      "mode": "text",
      "category": "text-symbol",
      "arity": 0,
      "safety": "pure",
      "side_effects": [],
      "expansion": [
        {
          "TText": "‚ñ°"
        }
      ],
      "body": [
        {
          "TText": "‚ñ°"
        }
      ],
      "expand_in_math": false,
      "expand_in_text": true,
      "non_expandable": true,
      "notes": "",
      "source": "derived-from:v1-catalogue",
      "_legacy_single_token": true
    },
    {
      "name": "Bumpeq",
      "mode": "math",
      "category": "math-operator",
      "arity": 0,
      "safety": "pure",
      "side_effects": [],
      "expansion": [
        {
          "TOp": "‚âé"
        }
      ],
      "body": [
        {
          "TOp": "‚âé"
        }
      ],
      "expand_in_math": true,
      "expand_in_text": false,
      "non_expandable": true,
      "notes": "",
      "source": "derived-from:v1-catalogue",
      "_legacy_single_token": true
    },
    {
      "name": "DH",
      "mode": "text",
      "category": "text-symbol",
      "arity": 0,
      "safety": "pure",
      "side_effects": [],
      "expansion": [
        {
          "TText": "√ê"
        }
      ],
      "body": [
        {
          "TText": "√ê"
        }
      ],
      "expand_in_math": false,
      "expand_in_text": true,
      "non_expandable": true,
      "notes": "",
      "source": "derived-from:v1-catalogue",
      "_legacy_single_token": true
    },
    {
      "name": "Delta",
      "mode": "math",
      "category": "greek-letter",
      "arity": 0,
      "safety": "pure",
      "side_effects": [],
      "expansion": [
        {
          "TText": "Œî"
        }
      ],
      "body": [
        {
          "TText": "Œî"
        }
      ],
      "expand_in_math": true,
      "expand_in_text": false,
      "non_expandable": true,
      "notes": "",
      "source": "derived-from:v1-catalogue",
      "_legacy_single_token": true
    },
    {
      "name": "Diamond",
      "mode": "text",
      "category": "text-symbol",
      "arity": 0,
      "safety": "pure",
      "side_effects": [],
      "expansion": [
        {
          "TText": "‚óá"
        }
      ],
      "body": [
        {
          "TText": "‚óá"
        }
      ],
      "expand_in_math": false,
      "expand_in_text": true,
      "non_expandable": true,
      "notes": "",
      "source": "derived-from:v1-catalogue",
      "_legacy_single_token": true
    },
    {
      "name": "Downarrow",
      "mode": "math",
      "category": "math-operator",
      "arity": 0,
      "safety": "pure",
      "side_effects": [],
      "expansion": [
        {
          "TOp": "‚áì"
        }
      ],
      "body": [
        {
          "TOp": "‚áì"
        }
      ],
      "expand_in_math": true,
      "expand_in_text": false,
      "non_expandable": true,
      "notes": "",
      "source": "derived-from:v1-catalogue",
      "_legacy_single_token": true
    },
    {
      "name": "Gamma",
      "mode": "math",
      "category": "greek-letter",
      "arity": 0,
      "safety": "pure",
      "side_effects": [],
      "expansion": [
        {
          "TText": "Œì"
        }
      ],
      "body": [
        {
          "TText": "Œì"
        }
      ],
      "expand_in_math": true,
      "expand_in_text": false,
      "non_expandable": true,
      "notes": "",
      "source": "derived-from:v1-catalogue",
      "_legacy_single_token": true
    },
    {
      "name": "Im",
      "mode": "math",
      "category": "text-symbol",
      "arity": 0,
      "safety": "pure",
      "side_effects": [],
      "expansion": [
        {
          "TText": "‚Ñë"
        }
      ],
      "body": [
        {
          "TText": "‚Ñë"
        }
      ],
      "expand_in_math": true,
      "expand_in_text": false,
      "non_expandable": true,
      "notes": "",
      "source": "derived-from:v1-catalogue",
      "_legacy_single_token": true
    },
    {
      "name": "L",
      "mode": "text",
      "category": "text-symbol",
      "arity": 0,
      "safety": "pure",
      "side_effects": [],
      "expansion": [
        {
          "TText": "≈Å"
        }
      ],
      "body": [
        {
          "TText": "≈Å"
        }
      ],
      "expand_in_math": false,
      "expand_in_text": true,
      "non_expandable": true,
      "notes": "",
      "source": "derived-from:v1-catalogue",
      "_legacy_single_token": true
    },
    {
      "name": "Lambda",
      "mode": "math",
      "category": "greek-letter",
      "arity": 0,
      "safety": "pure",
      "side_effects": [],
      "expansion": [
        {
          "TText": "Œõ"
        }
      ],
      "body": [
        {
          "TText": "Œõ"
        }
      ],
      "expand_in_math": true,
      "expand_in_text": false,
      "non_expandable": true,
      "notes": "",
      "source": "derived-from:v1-catalogue",
      "_legacy_single_token": true
    },
    {
      "name": "Leftarrow",
      "mode": "math",
      "category": "math-operator",
      "arity": 0,
      "safety": "pure",
      "side_effects": [],
      "expansion": [
        {
          "TOp": "‚áê"
        }
      ],
      "body": [
        {
          "TOp": "‚áê"
        }
      ],
      "expand_in_math": true,
      "expand_in_text": false,
      "non_expandable": true,
      "notes": "",
      "source": "derived-from:v1-catalogue",
      "_legacy_single_token": true
    },
    {
      "name": "Leftrightarrow",
      "mode": "math",
      "category": "math-operator",
      "arity": 0,
      "safety": "pure",
      "side_effects": [],
      "expansion": [
        {
          "TOp": "‚áî"
        }
      ],
      "body": [
        {
          "TOp": "‚áî"
        }
      ],
      "expand_in_math": true,
      "expand_in_text": false,
      "non_expandable": true,
      "notes": "",
      "source": "derived-from:v1-catalogue",
      "_legacy_single_token": true
    },
    {
      "name": "Longleftarrow",
      "mode": "math",
      "category": "math-operator",
      "arity": 0,
      "safety": "pure",
      "side_effects": [],
      "expansion": [
        {
          "TOp": "‚ü∏"
        }
      ],
      "body": [
        {
          "TOp": "‚ü∏"
        }
      ],
      "expand_in_math": true,
      "expand_in_text": false,
      "non_expandable": true,
      "notes": "",
      "source": "derived-from:v1-catalogue",
      "_legacy_single_token": true
    },
    {
      "name": "Longleftrightarrow",
      "mode": "math",
      "category": "math-operator",
      "arity": 0,
      "safety": "pure",
      "side_effects": [],
      "expansion": [
        {
          "TOp": "‚ü∫"
        }
      ],
      "body": [
        {
          "TOp": "‚ü∫"
        }
      ],
      "expand_in_math": true,
      "expand_in_text": false,
      "non_expandable": true,
      "notes": "",
      "source": "derived-from:v1-catalogue",
      "_legacy_single_token": true
    },
    {
      "name": "Longrightarrow",
      "mode": "math",
      "category": "math-operator",
      "arity": 0,
      "safety": "pure",
      "side_effects": [],
      "expansion": [
        {
          "TOp": "‚üπ"
        }
      ],
      "body": [
        {
          "TOp": "‚üπ"
        }
      ],
      "expand_in_math": true,
      "expand_in_text": false,
      "non_expandable": true,
      "notes": "",
      "source": "derived-from:v1-catalogue",
      "_legacy_single_token": true
    },
    {
      "name": "O",
      "mode": "text",
      "category": "text-symbol",
      "arity": 0,
      "safety": "pure",
      "side_effects": [],
      "expansion": [
        {
          "TText": "√ò"
        }
      ],
      "body": [
        {
          "TText": "√ò"
        }
      ],
      "expand_in_math": false,
      "expand_in_text": true,
      "non_expandable": true,
      "notes": "",
      "source": "derived-from:v1-catalogue",
      "_legacy_single_token": true
    },
    {
      "name": "OE",
      "mode": "text",
      "category": "text-symbol",
      "arity": 0,
      "safety": "pure",
      "side_effects": [],
      "expansion": [
        {
          "TText": "≈í"
        }
      ],
      "body": [
        {
          "TText": "≈í"
        }
      ],
      "expand_in_math": false,
      "expand_in_text": true,
      "non_expandable": true,
      "notes": "",